
3/22/2014,"Graham County Land Company, Hannibal, OH 43931",Worker struck and killed by falling tree. ,Fatality
3/21/2014,"Dolly DYK Cleaning Corp, Boston, MA 02116",Worker killed in fall down elevator shaft. ,Fatality
3/21/2014,"Mack's S & S Construction, Catoosa, OK 74015",Worker crushed by dump truck.,Fatality
3/20/2014,"Baker Hughes, Meshoppen, PA 18630",Worker killed in tractor trailer collision.,Fatality
3/20/2014,"Ensign United States Drilling Inc., Killdeer, ND 58640",Worker struck and killed by traveling blocks while working on a drilling rig.,Fatality
3/20/2014,"Haas-Anderson Construction Ltd, Sinton, TX 78387",Worker struck and killed by motor vehicle.,Fatality
3/20/2014,"Midwest Farmers Cooperative, Tecumseh, NE 68450",Worker died from exposure to anhydrous ammonia released during transfer from tanker trailer to bulk storage tank.,Fatality
3/20/2014,"Vision Pool, Newport Coast, CA 92657",Worker drowned in pool.,Fatality
3/20/2014,"Volles Dairy Farm LLC, Marietta, NY 13110",Worker performing maintenance on truck was crushed by  hydraulic dump body. ,Fatality
3/19/2014,"Chicago Doorways LLC, Chicago, IL 60611",Worker died after falling from ladder.,Fatality
3/19/2014,"G.E. Drywall, Bella Vista, CA 96008",Worker killed in fall from height.,Fatality
3/19/2014,"Ingram Ready Mix, Converse, TX 78109",Worker struck and run over by truck.     ,Fatality
3/19/2014,"Mendocina County Sheriff's Office, Cleone, CA 95437",Worker shot while in pursuit of suspect.,Fatality
3/19/2014,"Redwing Electric, LLC, Pasadena, MD 21122",Worker killed in fall from water tower.,Fatality
3/18/2014,"The Coca-Cola Company, Atlanta, GA 30308",Worker killed in fall on stairway.,Fatality
3/18/2014,"Will County - ICT Department, Joliet, IL 60432",Worker killed in motor vehicle collision.,Fatality
3/17/2014,"City of Oaks Forest - Police Dept., Oak Forest, IL 60452",Worker responding to domestic violence call struck and killed by a motor vehicle.,Fatality
3/17/2014,"Meekhof Tire Sales and Service, Inc.                                                        Grand Rapids, MI 49503",Worker repairing tire was crushed when truck cab fell on him.,Fatality
3/17/2014,"Varsity Cycle Inc., Wilton Manors, FL 33306",Worker killed in motor vehicle collision.,Fatality
3/16/2014,"Caring and Sharing of South Walton County Inc., Santa Rosa Beach, FL 32459",Worker killed in fall from truck. ,Fatality
3/15/2014,"BF Fort Myers Inc., Punta Gorda, FL 33951",Worker electrocuted while repairing machine.,Fatality
3/15/2014,"Eckhart Construction Services Inc., Matthews, NC 28104  ",Worker struck and killed by skid steer loader. ,Fatality
3/15/2014,"Full Service Scaffold, Sacramento, CA 94203",Worker killed in fall from scaffold platform. ,Fatality
3/15/2014,"Nabors Drilling Ltd, Fowlerton, TX 78021",Worker struck and killed by unsecured equipment.,Fatality
3/15/2014,"Prairie Ag Partners, Lake Preston, SD 57249",Worker engulfed by beans while cleaning storage bin.,Fatality
3/15/2014,"Saunier Moving and Storage, Smith Grove, KY 42171",Worker killed in truck fire after motor vehicle collision.,Fatality
3/14/2014,"Bruce Babb Chemicals, Rankin, TX 79778","Worker killed in a motor vehicle collision.
",Fatality
3/14/2014,"Evergreen Golf Design Inc., Marysville, WA 98271",Worker killed when riding lawnmower flipped over onto him.,Fatality
3/14/2014,"First Graphic Services Inc., Garland, TX 75040",Worker struck and killed by falling signs. ,Fatality
3/14/2014,"Industrial Air, Inc., Greensboro, NC  27419",Worker died from fall while cleaning duct work box.,Fatality
3/14/2014,"Michels Pipeline Construction, Inc., Cedar Rapids, IA 52403",Worker struck and killed by metal boring rods during cutting.,Fatality
3/14/2014,"SIMMCO, Shreveport, LA 71149",Worker struck and killed when pipes rolled off trailer during unloading.,Fatality
3/13/2014,303 E Mifflin St ORWIGSBURG  PA 17961,Worker was run over by delivery truck.,Fatality
3/13/2014,"Bluffs Golf LLC, Saint Francisville, LA 70775",Worker died from head injury after being ejected from golf cart.,Fatality
3/13/2014,"Layton Manufacturing Corporation, Brooklyn, NY 11203",Worker died from carbon monoxide poisoning.,Fatality
3/12/2014,"Stark Truss, Auburn, KY 42206",Worker caught and killed in a press while trying to retrieve a hammer.,Fatality
3/12/2014,"TNT Oil Co., Irvine, PA 16329",Worker was killed when fuel tank exploded. ,Fatality
3/12/2014,"Your Employment Service Staffing Inc., Little Rock, AR 72209",Temporary worker killed in fall from rooftop. ,Fatality
3/11/2014,"Eaton Corporation, Sarasota, FL 34243",Worker struck and killed by a piece of equipment when a jack failed. ,Fatality
3/11/2014,"Glacier Fish Company, Dutch Harbor, AK 99692",Worker struck and killed by heavy object in explosion.,Fatality
3/11/2014,"Higa Meat and Pork Market Limited, Honolulu, HI 96817",Worker killed in fall from pallet of boxes.,Fatality
3/11/2014,"Mastec Advanced Technology, Dallas, TX 75238",Worker killed in motor vehicle collision. ,Fatality
3/11/2014,"Norandal USA Inc., Newport, AR 72112",Worker killed after being caught in machinery while clearing a jam. ,Fatality
3/11/2014,"Strike LLC, Corpus Christi, TX 78401",Four employees hospitalized with burns from a flash fire. ,Catastrophe
3/10/2014,"AC Body Works & Sons LLC, Schenectady, NY 12306",Worker crushed between a truck and carwash spray booth. ,Fatality
3/10/2014,"Aloha Tree Service, Long Beach, CA  90813",Worker died from fall while performing tree trimming operations.,Fatality
3/10/2014,"Behr Iron & Steel Inc., South Beloit, IL 61080",Employer died after being caught in the tail pulley of a shredding machine conveyor belt. ,Fatality
3/10/2014,"Cardinal Transport Inc., Hanover, MN 55341",Worker struck and killed by pipe while loading truck.,Fatality
3/10/2014,"Dynamex, Hayward, CA 94545",Worker was struck and killed by a motor vehicle.,Fatality
3/10/2014,"Little Richard Logging, Parish, NY 13131",Worker struck and killed while performing logging operations.,Fatality
3/10/2014,"M & M Striping & Power Washing LLC, Italy, TX 76651",Worker backed over by truck during litter control operations. ,Fatality
3/9/2014,"North Star Painting Co, Saint James, LA 70086",Worker killed in fall from bridge.,Fatality
3/9/2014,"R Betances Construccion LLC, Toa Baja, PR 00949",Worker was struck and killed by truck that was backing up.,Fatality
3/9/2014,"U. S. Postal Service, Buffalo, NY 14206",Worker died from head injury suffered in fall.,Fatality
3/8/2014,"DKJR Roofing, Remsen, IA 51051 ",Worker killed in fall from frost covered roof.,Fatality
3/7/2014,"Steve's Auto Service, Buffalo, NY 14211",Worker repairing a fuel pump was fatally burned when gasoline ignited.,Fatality
3/6/2014,"Adar Steel Inc, Brooklyn, NY 11249",Worker killed in fall while installing decking.,Fatality
3/6/2014,"Adventure Photo Tours Inc.,  Overton, NV 89040",Worker was pinned and crushed between rolling vehicle and rocks.,Fatality
3/6/2014,"Bushwick Metals LLC, South Plainfield, NJ 07080",Worker crushed by steel beams.,Fatality
3/6/2014,"Valley Grove Dairy Farm, Hastings, MI 49058",Worker was fatally mauled by a bull.,Fatality
3/6/2014,"WW LLC, Brownfield, TX 79316",Worker crushed and killed by a tank.,Fatality
3/5/2014,"Acme Electric Company, Cedar Rapids, IA 52404",Worker was electrocuted by live electrical storage capacitor. ,Fatality
3/5/2014,"Colonial Plastics, Shelby Twp, MI 48315",Worker checking parts on an injection molding machine was crushed when the machine activated.,Fatality
3/4/2014,"PSEG, Ewing, NJ 08560",Three employees were hospitalized from a gas leak explosion.,Catastrophe
3/4/2014,"St. Vincent De Paul Particular Council of Flint, Flint, MI 48506",Worker was pinned and crushed between trailer and truck.,Fatality
3/4/2014,"Wolf Creek Ski Area, Pagosa Springs, CO 81147",Employee died in a cave-in caused by an avalanche. ,Fatality
3/3/2014,"Confluence Health,  Pateros, WA 98846",Worker killed in motor vehicle collision.,Fatality
3/3/2014,"North Dakota Pipeline Company LLC, Grand Forks, ND 58201",Employee killed in a motor vehicle collision.,Fatality
3/3/2014,"Now and Never, Kersey, CO 80644",Worker killed from exposure to oil tank fumes. ,Fatality
3/2/2014,"Cardinal Logistics Management Corp, Roseburg, OR 97470",Worker killed in vehicle collision.,Fatality
3/2/2014,"LTI Inc.,  Lynden, WA 98264",Worker killed in motor vehicle collision.,Fatality
3/2/2014,"Mobile Diesel Service LLC, Roseburg, OR 97470",Worker performing maintenance on a semi-trailer was crushed between truck and service vehicle.,Fatality
3/2/2014,"Team Steel Fabricators LLC, Youngstown, OH 44505","Worker killed in maintenance shop fire.

",Fatality
3/1/2014,"Bandera Drilling Co. Inc., Big Spring, TX 79720",Worker was crushed by forklift while making repairs. ,Fatality
3/1/2014,"Chad Menefee Construction, Mount Pleasant, TX 75455",Worker died when the dump truck he was operating rolled into a ditch. ,Fatality
2/28/2014,"Borough of Fair Lawn, Fair Lawn, NJ 07410",Worker died after falling from recycling vehicle.,Fatality
2/28/2014,"C G Roxane Water Co., Benton, TN 37307                                                               ",Worker struck and killed by forklift mast.,Fatality
2/28/2014,"East Coast Mines & Materials Corp., East Quogue, NY 11942",Worker killed after being engulfed by mulch.,Fatality
2/28/2014,"Fritchas, New Haven, IN 46774                                               ",Worker crushed by dump truck during snow removal.,Fatality
2/28/2014,"Nordstrom Inc., Spokane, WA  99201",Worker killed in fall from ladder.,Fatality
2/28/2014,"Pace’s Hauling & Clearing, Clayton, NC  27527",Backhoe worker was struck and killed by falling tree.,Fatality
2/28/2014,"Wieser Concrete Products Inc., Portage, WI 53901",Worker crushed structure that fell from overhead crane.,Fatality
2/27/2014,"A & Z General Contractors Inc., Beach Haven, NJ 08008",Worker killed in fall from ladder. ,Fatality
2/27/2014,"Columbus Transport Inc., Chadbourn, NC 28431 ",Worker killed in fall on vertical steel rebar.,Fatality
2/27/2014,"Duke Energy, South Lebanon, OH 45065",Worker struck and killed by collapsed utility pole.  ,Fatality
2/27/2014,"Senaca Foods, Oakfield, WI 53065",Worker died after being caught in a lathe while performing maintenance. ,Fatality
2/27/2014,"Wallington Volunteer Fire Department, Wallington, NJ 07057",Worker responding to fire killed in fall from roof.,Fatality
2/26/2014,"Aztec Grading Inc., Peralta, NM 87042",Worker backed over and killed by a truck while paving the road.,Fatality
2/26/2014,"BT Inc., Kemmerer, WY 83101                                              ",Worker loading semi-trailer truck died in fall from elevated platform.,Fatality
2/26/2014,"Eliseo Castro, Houston, TX 77043",Worker was electrocuted when the leg of a scaffold he was dismantling contacted a power line.,Fatality
2/26/2014,"Heartland Manufacturing Group, Peculiar, MO 64078",Worker was crushed between two trucks.,Fatality
2/26/2014,"Simpson Environmental Services Inc., Hollywood, FL 33019",Worker killed in fall from scaffold. ,Fatality
2/25/2014,"J.F. Electric Incorporated, Pekin, IL 61554",Worker electrocuted while transferring power from transmission lines. ,Fatality
2/24/2014,"Hogan Inc., Naples, FL 34103",Worker electrocuted when the pole saw he was using to trim trees contacted power lines.,Fatality
2/24/2014,"Maverick Drilling, Missouri City, TX 77489",Two workers on a drilling rig were electrocuted after contacting overhead power lines.,Fatality
2/24/2014,"Pasadena Tank Corporation, Corpus Christi, TX 78409",Worker struck and killed by pipe that fell from crane.,Fatality
2/23/2014,"Five Star Roustabouts LLC, O'Brien, TX 79539",Worker struck and killed by motor vehicle.  ,Fatality
2/22/2014,"Kilgore Flares Co LLC,Toone, TN                                      ",Worker removing residual flare materials died from burns suffered in flash fire/explosion.,Fatality
2/22/2014,"Legal Sea Foods LLC, Huntington Station, NY 11746",Restaurant worker died from carbon monoxide exposure.,Fatality
2/22/2014,"Stubbs Heating and Cooling, Magee, MS 39111",Worker struck and killed by a crane boom.,Fatality
2/21/2014,"Keith R Olmsted, Shiocton, WI 54170",Worker struck and killed by a bulk milk trailer.,Fatality
2/21/2014,"MidSouth Elevator LLC, Jackson, MS 39212",Worker on top of elevator performing repairs was crushed against  ceiling when the elevator was activated.,Fatality
2/21/2014,"Ray Eager and Sons LLC, Cochranville, PA 19330",Worker using pressure washer was killed in fall through floor opening.,Fatality
2/21/2014,"Tacoma Moving & Storage Co., Kent, WA 98032",Worker was crushed between two trucks.,Fatality
2/21/2014,"Vintage Gardens Nursery & Feed, Portola, CA 96122",Worker was struck and killed by a falling tree.,Fatality
2/20/2014,"Film Allman LLC, Jesup, GA 31598",Film crew worker was struck and killed by a train while preparing to shoot a scene.,Fatality
2/20/2014,"Helena Chemical Company, Benton, IA 50835",Worker struck and killed when a steel belt conveyor system fell on him.,Fatality
2/20/2014,"Joseph Bates, Lexington, KY 40508",Worker was struck and killed by wood that fell from roof.,Fatality
2/20/2014,"Monti Home Improvements Inc., Monticello, IA 52310",Worker installing garage door died in fall from scaffold.,Fatality
2/19/2014,"Arkansas Steel Associates LLC, Newport, AR 72112",Employer killed by molten steel that spilled from an overhead crane. ,Fatality
2/19/2014,"Folsom Construction LLC, South Windsor, CT 06074",Owner and driver electrocuted when their dump truck contacted a transmission line.  ,Fatality
2/18/2014,"KB Oil and Gas, Inc., McKittrick, CA 93251",Worker killed in fall from oil rig cab.,Fatality
2/18/2014,"MGM Grand Las Vegas, Las Vegas, NV 89109",Worker died after tripping and falling on curb.  ,Fatality
2/18/2014,"Thermo Power Industries, Long Beach, CA 90802",Worker killed in fall from scaffold.,Fatality
2/15/2014,"Bunn-O-Matic, Creston, IA 50801",Worker died after slipping and falling on icy stairs.,Fatality
2/15/2014,"Cyclone Trucking, Inc., Douglas, WY  82633",Worker was struck and killed by truck as it was backing up.,Fatality
2/14/2014,"64 Stefanak Drive, West Middlesex, PA 16159",Worker died after being pinned between a tractor cab and trailer. ,Fatality
2/14/2014,"Il Dept of Transportation - Dist. 4 Wyoming Yard, Toulon, IL 61483",Worker was struck and killed by motor vehicle while assisting motorists.,Fatality
2/14/2014,"Logistics One, Inc., Fairlee, VT  05045",Worker was struck and killed by a motor vehicle.,Fatality
2/14/2014,"Republic Steel, Lorain, OH 44055",Worker struck and killed by railroad car that derailed.,Fatality
2/14/2014,"Rexel Holdings USA Corp., Houston, TX 77024",Worker died in fall from a warehouse dock. ,Fatality
2/14/2014,"United States Steel Corporation, Clairton, PA 15025",Worker killed from fall into a trench.,Fatality
2/13/2014,"Thomas N. Richards & Son, Poland, ME 04274",Worker killed when a logging truck rolled over and crushed him.  ,Fatality
2/13/2014,"Volvo Construction Equipment & Services, San Leandro, CA  94577",Worker was crushed by machine that fell off its support stands.,Fatality
2/12/2014,"358 Elmwood Ave MCM Auto Sales LLC, Providence, RI 02907",Worker struck and killed by tow truck.  ,Fatality
2/12/2014,"MTA NYCT DOB MJ Quill Depot, NYC, NY 10018",Worker was killed in vehicle collision.,Fatality
2/12/2014,"Tanner Timber Services LLC, Kountze, TX 77625",Worker struck and killed by log while feeding it into a bull edger. ,Fatality
2/11/2014,"Anderson Farms Inc., Heyburn, ID 83336",Worker killed after falling into a feed mixer.,Fatality
2/11/2014,"H&E Equipment Services, Inc., Los Angeles, CA 90015",Worker died when the boom lift he was in was struck by a bus. ,Fatality
2/11/2014,"Nucor Steel, Blytheville, AR 72315",Train operator died after being caught between locomotive and a derailed car.,Fatality
2/11/2014,"WAH, Inc., Enterprise, OR  97828",Cross-country skiing guide was killed in an avalanche.,Fatality
2/10/2014,"Brindle Technical Logging, Inc., Morton, WA 98356",Worker was struck and killed by a log.,Fatality
2/10/2014,"New Hampshire Ball Bearing, Peterborough, NH 03458",Eight workers hospitalized after a drum of nitric acid solution exploded.,Catastrophe
2/10/2014,"Randy Sterling Trucking Inc., Morrisdale, PA 16858",Worker killed when truck rolled over him during repairs.,Fatality
2/10/2014,"Sperle Family Farm, Napoleon, ND 58561",Worker died after being engulfed by grain.,Fatality
2/10/2014,"Wheeler Electric Inc., Idaho Falls, ID 83404",Worker struck and killed by a switch panel. ,Fatality
2/9/2014,"Jarrell Contractors Inc., Fairview, WV 26570",Three workers hospitalized from overexposure to carbon monoxide.  ,Catastrophe
2/8/2014,"Sierra Lawn Care Service, Saint Petersburg, FL 33705",Worker electrocuted by powerline while trimming trees. ,Fatality
2/8/2014,"Total Appearance Exhibit Service Inc., Tulare, CA  93274",Worker was struck and killed by a tractor trailer.,Fatality
2/7/2014,"Interfacing Company of Texas Inc., Manvel, TX 77578",Worker killed in trench collapse. ,Fatality
2/7/2014,"Qc of Kentucky Inc., Calvert City, KY 42029",Worker died after inhaling nitrogen.,Fatality
2/6/2014,"Don Hamann, Inc., Selma, OR 97538",Worker was struck and killed by a tree limb.,Fatality
2/6/2014,"Jack Spring Electrical Contractors Inc., Benton, LA 71006",Worker electrocuted while repairing a transformer.,Fatality
2/5/2014,"Advocate Good Shepherd Hospital, Barrington, IL 60010",Worker struck and killed by snow plow.,Fatality
2/5/2014,"Kahanakoa Construction, Inc., Holualou, HI 96725",Worker died when a drum compactor crashed into a carport.,Fatality
2/4/2014,"Brickell Hotel Group LLP, Miami, FL 33130",Worker killed in vehicle collision.,Fatality
2/4/2014,"Via Christi Hospital, Pittsburg, KS 66762",Nurse struck and killed by motor vehicle.,Fatality
2/4/2014,"Wayne Terry, Brooksville, KY 41004",Worker killed in fall through manhole.,Fatality
2/3/2014,"Enterprise Farms, Moravia, NY 13118",Worker killed after being caught in a feed auger.,Fatality
2/3/2014,"NEL & Sons Inc., Coral Gables, FL 33134",Worker killed in fall from ladder.,Fatality
2/3/2014,"Patron Services LLC, Artesia, NM  88210",Worker was electrocuted when crane contacted a powerline.,Fatality
2/2/2014,"Eastern Truck Equipment LLC, Boonsboro, MD 21713",Worker was struck and killed by a tractor tire that exploded during inflation.,Fatality
2/2/2014,"Happy Dog Restaurant, Cleveland, OH 44102",Worker died in fall down stairs.,Fatality
2/1/2014,"Med Care Pharmacy LLC, Grayson, KY 41042",Worker killed in motor vehicle collision.,Fatality
2/1/2014,"S. & S. Communication Specialist Inc., Clarksburg, WV 26301",Two workers killed in a communications tower collapse.,Fatality
1/31/2014,"Curtis Steel Co., Inc., Las Vegas, NV 89102",Worker struck and killed by bundle of steel.,Fatality
1/31/2014,"Erosion Control & Landscape Services Inc., Pikeville, MD 21108",Worker was struck and killed by a motor vehicle.,Fatality
1/31/2014,"Maruichi Leavitt Pipe & Tube, Chicago, IL 60643",Worker cutting metal tubing died after being caught by a large band saw. ,Fatality
1/31/2014,"Step Above Home Maintenance, Farmington Hills, MI 48335",Worker died in fall from roof.,Fatality
1/31/2014,"United Mechnical Corporation, Shelby, NC  28151",Worker struck and killed by a pipe.,Fatality
1/30/2014,"Jesus Orta, Forney, TX 75126",Worker killed in fall from scaffold while finishing drywall.,Fatality
1/30/2014,"Mayville Engineering, Beaver Dam, WI 53916",Worker killed in vehicle collision during a snow storm. ,Fatality
1/30/2014,"Mersen USA St. Marys-PA Corporation, Saint Marys, PA 15857",Worker killed when an industrial oven exploded.,Fatality
1/29/2014,"Graham Lumber Company, Selmer, TN  38375",Worker killed after being caught by a conveyor.,Fatality
1/29/2014,"NTS Incorporated of Texas, Wheeler, TX 79096",Four workers hospitalized for burns after a natural gas pipeline explosion.,Catastrophe
1/29/2014,"VCA Buckeahd, NE Atlanta, GA 30324",Worker died after being dragged by dog he was walking.,Fatality
1/28/2014,"Compressed Air Systems LLC, Grand Prairie, TX 75052",Worker struck and killed when an air compressor exploded during maintenance.,Fatality
1/28/2014,"Derr & Isbell Construction LLC, Waco, TX 76704",Worker in a hydraulic boom lift died when it fell off a barge.,Fatality
1/27/2014,"Dan and Maes Dairy, Westford, NY 13488",Worker killed when his clothes caught in a corn chopper and pulled him into the machine.,Fatality
1/27/2014,"Holy Cross Energy, Silt, CO 81652",Worker inspecting power lines was killed in a helicopter crash.  ,Fatality
1/27/2014,"IL State Toll Highway Authority,  Aurora, IL  60507",One worker was killed and another hospitalized after being struck by a motor vehicle while providing roadside assistance.,Fatality
1/26/2014,"Cheek Enterprises Inc., Senatobia, MS 38668",Employer died in fall from ladder.,Fatality
1/25/2014,"Jose Luiz Martinez, Gainesville, GA 30506",Employer died in fall from elevated bucket while removing a tree.,Fatality
1/25/2014,"Snapper Generator & Starter Repair, Atlanta, GA 30310",Worker installing a transmission underneath vehicle was crushed when the car fell onto him. ,Fatality
1/24/2014,"Arborcare Tree Experts, Inc., Lutherville, MD  21093",Worker was struck and killed by falling tree branch.,Fatality
1/24/2014,"GPS Plumbing, Bethesda, MD  20814",Worker struck and killed while working in a trench.,Fatality
1/24/2014,"Mario Martinez dba Martinez Fence Company, Nashville, TN 37210",Worker struck and killed by a bundle of pipes that fell from truck.,Fatality
1/24/2014,"Mark Trabucco, Los Olivos, CA 93441",Worker killed when bulldozer overturned.,Fatality
1/24/2014,"Offshore Rentals Ltd, Golden Meadow, LA 70357",Worker struck and killed by a forklift. ,Fatality
1/24/2014,"Paragon Industries Inc., Sapulpa, OK 74066",Worker died after falling off and being run over by loader.  ,Fatality
1/24/2014,"Phoenix Refrigeration, Inc., Grand Rapids, MI 49534",Worker killed in fall from ladder.,Fatality
1/24/2014,"Quick Transport of Arkansas Inc., Knoxville, AR 72845",Worker struck and killed when trailer hatch exploded during defrosting with propane torch.,Fatality
1/24/2014,"R.V.H. Trucking, LLC, Mentone, IN 46539",Worker killed when an air dryer exploded.,Fatality
1/24/2014,"The Anderson White Pigeon Grain, White Pigeon, MI 49099",Worker suffocated after falling  through hatch into  a railroad car filled with soybeans,Fatality
1/23/2014,"A-1 Florida Sod Inc., Mulberry, FL 33860",Worker died after being crushed in motorized equipment.,Fatality
1/23/2014,"Exterior Recovery, Inc., Raleigh, NC 27616",Worker died in fall while applying commercial siding.  ,Fatality
1/23/2014,"Romeo Dimon Marine Service Inc., Mattituck, NY 11952",Worker crushed by the bucket of a compact track loader.,Fatality
1/23/2014,"The Traffic Group Inc., Van Buren AR 72957",Worker struck and killed by motor vehicle.,Fatality
1/23/2014,"US Army Reserve-AMSA, Guaynabo, PR 00965",Forklift operator struck and killed by a fire extinguisher that exploded during disposal.  ,Fatality
1/22/2014,"International Paper, Bogalusa, LA 70427",Worker drowned when front end loader went into a water catchment basin.,Fatality
1/22/2014,"Linn Dale Logging, Pollock, TX 75969",Worker struck and killed by falling tree while performing logging work.,Fatality
1/22/2014,"Riddle Painting & Coatings, Phoenix, AZ 85009",Two workers killed when aerial lift tipped over.,Fatality
1/22/2014,"Weathercraft Co. of Colorado Springs, Colorado Springs, CO 80903",Worker struck and killed by a failed cable on an outside fire escape system.,Fatality
1/21/2014,"George B Stone Company, LLC, Wilmore, KY 40374",Worker struck and killed by motor vehicle.,Fatality
1/21/2014,"Global Pacific Environmental, Inc., White City, OR 97503",Worker crushed between wall and dump truck.,Fatality
1/21/2014,"Lineage LLC, Dacoma, OK 73731",Worker killed when his vehicle was struck by a train. ,Fatality
1/21/2014,"Sully Truck Wash, Inc., Sully, IA  50251",One worker died and two hospitalized after becoming trapped in a truck wash tank trailer. ,Fatality
1/20/2014,"7 Seas Seafood, Montebello, CA 90640",Worker crushed beneath car.,Fatality
1/20/2014,"Ball Cabinet Shop, New Braunfels, TX 78130",Worker killed in fall from scaffold. ,Fatality
1/20/2014,"El Dorado Livestock Auction, El Dorado, KS 67042",Worker died in fall from horse.,Fatality
1/20/2014,"International Nutrition Inc., Omaha, NE 68127",Two workers killed in structure collapse. ,Fatality
1/20/2014,"Kel-Log Inc., Errol, NH 03579",Worker struck and killed by semi-truck while installing snow chains on tires of company vehicle. ,Fatality
1/20/2014,"Lobar Inc., Windsor, PA 17366",Worker crushed under fallen switchgear. ,Fatality
1/20/2014,"Mid American Steel & Wire, Madill, OK 73446",Two workers killed in an electric arc furnace explosion.  ,Fatality
1/20/2014,"Rich Valley Farms Inc., Red Bud, IL 62278",Worker died after falling into grain bin filled with corn.,Fatality
1/18/2014,"Dement Construction Company, LLC,  Stanton, TN  38069",Worker crushed between aerial lift control panel and concrete beam. ,Fatality
1/18/2014,"Ground Earth Inc., Fall River,  MA 02721",Employer working under vehicle was crushed when it rolled over him.,Fatality
1/18/2014,"Precision Drilling Corporation, Rankin, TX 79778",Worker crushed between fallen section of derrick and wheel. ,Fatality
1/17/2014,"Crown Equipment Corp, Carmichael, CA 95608",Worker crushed by frame of forklift.,Fatality
1/17/2014,"Kansas Hardwoods Inc., Belvue, KS 66407",Worker struck and killed by tree while engaged in logging activities.,Fatality
