NE,6/24/12,"T.H. Construction Company, Bennet, NE 68317",Worker using a pipe wrench to loosen the cap from an utility line was killed when the wrench struck his head.,Unknown,40.6777777,-96.5069575,,,WV,6/25/12,"A C & S Inc., Nitro, WV 25143",Worker using a supply air hood to perform sandblast operations died from asphyxiation when the air hood was wrongfully connected to a nitrogen line.,Unknown,38.4148146,-81.8440197,,,NC,6/29/12,"S&S Graham Archery Sales Inc., China Grove, NC 28023",Worker using acetone to perform taxidermy activities was killed when the pilot light from a water heater ignited the acetone vapors, causing a fire.,Unknown,35.569306,-80.5817318,,KS,6/29/12,"Solomon Corporation, Solomon, KS 67480",Worker was crushed by a 9,000-pound electrical transformer.,Unknown,38.9194442,-97.371137,,TX,7/1/12,"Thornton Drilling Company, Andrews, TX 79714",Worker power washing a water tank was electrocuted when the power cords arced.,Unknown,32.3187158,-102.5457155,,,MI,7/2/12,"Black River Builders, Zeeland, MI 49464",Worker performing roof repairs died after falling nearly 25 feet through the roof.,Unknown,42.8125246,-86.018651,,,MO,7/2/12,"Chester Bross Construction Co. Inc., Bloomsdale, MO 63627",Worker was doing highway construction and was struck and killed by a dump truck.,Unknown,38.0094981,-90.2178964,,,NM,7/4/12,"San Saba Pecan, Las Cruces, NM 88005",Worker using a scissor lift died from injuries suffered when the lift toppled over.,Unknown,32.2275136,-106.8414374,,,CA,7/5/12,"Alameda County Fair, Pleasanton, CA 94566",Horse jockey died after being thrown from horse and trampled on.,Unknown,37.666391,-121.883664,,,TX,7/5/12,"Platinum Energy Services, Chireno, TX 75937",Worker was killed when the cap of a pressure manifold struck his head.,Unknown,31.4993498,-94.3518691,,,WA,7/7/12,"Consolidated Fruit LLC, Wapato, WA 98951",Worker operating a forklift was crushed when the vehicle went off the side of the road and tipped over.,Unknown,46.4476278,-120.4203382,,,TN,6/13/12,"Scruggs Equipment Company, Memphis, TN 38113",Worker performing maintenance on a front end garbage truck loader was crushed between the driver's side lifting arm and the debris body of the truck.,Unknown,35.1059719,-90.0992722,,,MA,7/1/12,"R.G. Lumber Corp., Jackman, MA 04945",A worker moving a logging machine died when the machine struck him.,Unknown,45.4890344,-70.3023813,,,MD,7/2/12,"Oakland Timberjax LLC, Oakland, MD 21550",Worker cutting down trees after storm damage died after falling more than 50 feet to the ground.,Unknown,39.4078747,-79.4067116,,,MA,7/2/12,"R.G. Lumber Corp., Jackman, MA 04945",A worker moving a logging machine died when the machine struck him.,Unknown,45.4890344,-70.3023813,,,NC,7/2/12,"W.W. Landscaping Inc., Pinetops, NC 27864",Worker cutting down a nearly 100-foot-high pine tree was struck and killed by another falling tree.,Unknown,35.7884908,-77.6377521,,,GA,7/3/12,"Escoe Industrial, Jefferson, GA 30549",Worker was electrocuted after falling onto a 4,100-volt switch gear.,Unknown,34.1170537,-83.5723876,,WI,7/3/12,"Laning's Dairy Supply, Rosendale, WI 54974",Worker installing a cattle spraying apparatus was struck by a cattle gate carriage, pinning worker between the carriage and a post.,Unknown,43.8077629,-88.674832,,IA,7/5/12,"Mail Contractors of America, Urbandale, IA 50322",Worker was run over and killed when he tried to stop a moving tractor.,Unknown,41.6304923,-93.7333537,,,WI,7/5/12,"Spancrete, Oshkosh, WI 54901",Worker was struck and killed by a crane boom.,Unknown,44.0247062,-88.5426136,,,MA,7/6/12,"Brookside Farms Inc., West Townsend, MA 01474",Worker loading a hay trailer was killed when the trailer rolled backwards, crushing him.,Unknown,42.6675405,-71.7503855,,OH,7/8/12,"Owens Coming, Newark, OH 43055",Worker for an insulation manufacturer was found dead from possible heat stress.,Unknown,40.0581205,-82.4012642,,,FL,7/9/12,"Coastal Parasail, Inc., Panama City Beach, FL 32408",Worker collecting trash was run over by a trash truck.,Unknown,30.14763,-85.735897,,,IA,7/9/12,"Consumers Cooperative Society, Kalona, IA 52247",Worker cleaning out a grain bin was found unresponsive on ground near bin.,Unknown,41.4830723,-91.7060015,,,OR,7/10/12,"Knife River Corporation - Northwest, Canby, OR 97013",Worker placing roadway signs at an intersection was struck and killed by a vehicle.,Unknown,45.2622655,-122.6921006,,,FL,7/10/12,"Pioneers International, Inc., Orlando, FL 32832",Worker operating a riding lawn mower was found in a canal pinned underneath the mower.,Unknown,28.4107024,-81.1857736,,,TN,7/13/12,"Dillard Smith Crossville, TN 38572",Worker replacing broken electric poles was electrocuted after touching a live power line.,Unknown,35.9489566,-85.0269014,,,TX,7/13/12,"RM Walsdorf Inc., Brownsville, TX 78521",Worker performing maintenance work on a paving machine was crushed when the hydraulic line gave way, causing the machine to fall.,Unknown,25.9739925,-97.330053,,OH,4/26/12,"Alside Supply Center, Cuyahoga Falls, OH 44223",Worker at a residential building supply company died from a possible heart attack.,Unknown,41.1740315,-81.521241,,,CT,7/12/12,"Welding Services Inc., Stamford, CT 06902",Worker was electrocuted while reinforcing steel.,Unknown,41.0411194,-73.541744,,,PA,7/13/12,"Baker Logging, Williamsburg, PA 16693",Worker cutting lumber was struck and killed by a falling tree.,Unknown,40.4620172,-78.199732,,,PA,7/17/12,"Bruce and Merrilees Electric Company, New Castle, PA 16101",Worker transporting a telephone pole died from head trauma when a vehicle hit the pole, causing the pole to strike the worker's head.,Unknown,41.0036719,-80.347009,,WI,7/17/12,"Inland Systems Incorporated, Tomahawk, WI 54487",Worker cleaning an ash silo died from burns received by flying ash.,Unknown,45.4710792,-89.7298594,,,FL,7/18/12,"Bonedty Enterprises Inc., St. Augustine, FL 32080",Worker on a tractor cutting grass was killed after being struck by a vehicle and thrown from the tractor.,Unknown,29.8942639,-81.3132083,,,IN,7/19/12,"Living Waters Lutheran Church Fort Wayne, IN 46816",Worker was struck and killed by a motor vehicle.,Unknown,41.0233277,-85.0337392,,,TN,7/19/12,"Rafael Esparza Germantown, TN 38139",Worker died after falling 13 feet from a roof while tossing materials to wheel a barrow.,Unknown,35.0881102,-89.7520768,,,AL,7/16/12,"J.C. Hamm & Sons, Inc., Florence, AL 35630",Worker changing a filter in an attic died of a possible electrocution.,Unknown,34.8287425,-87.6482474,,,CO,7/21/12,"Public Service of Colorado, Lyons, CO 80540",Worker performing work on a gas pipeline died from cardiac arrest.,Unknown,40.2247075,-105.271378,,,CA,7/22/12,"All American Asphalt, Torrance, CA 90502",Two workers were killed, one injured after they were struck by two vehicles while laying concrete on a highway.,Unknown,33.8331717,-118.2906661,,CA,7/22/12,"Dalton Trucking Inc., Fontana, CA 92335",Worker repairing bottom of dump sand truck was caught between the truck's pneumatic and hydraulic bottom gates.,Unknown,34.083787,-117.4673845,,,NY,7/23/12,"Locust Valley CSD, Locust Valley, NY 11560",A school bus driver was killed when a cement mixer collided head-on with the bus.,Unknown,40.8866446,-73.5947459,,,OR,7/23/12,"Pacific Coast Contracting Inc., Medford, OR 97501",Worker was killed when the forestry van he was riding in was struck by a motor vehicle.,Unknown,42.3265152,-122.8755949,,,CA,7/23/12,"Sierra Pacific Industries, Sonora, CA 95370",Worker at a lumber mill was crushed in a machine.,Unknown,32.5221427,-116.9722595,,,CT,7/23/12,"Tayco Corp., Wallingford, CT 06492",Worker operating a truck on a dirt surface was crushed when the truck tipped over, pinning the worker underneath.,Unknown,41.4570108,-72.8230736,,CA,7/23/12,"Terra Nova Ranch, Helm, CA 93627",Farm worker died from head injuries when his ATV hit a tomato trailer.,Unknown,36.5158276,-120.1242853,,,NC,7/26/12,"Evonik Stockhausen LLC, Greensboro, NC 27406",Worker was pinned between a commercial carrier cab and a trailer.,Unknown,36.0196499,-79.7624177,,,CA,7/27/12,"Carlton Forge Works,Paramount, CA 90723",Worker performing forging activities was struck and killed by debris.,Unknown,33.8894598,-118.1597911,,,TX,7/27/12,"Robinson Drilling of Texas Ltd., Big Lake, TX 76932",Worker performing oil rigging activities died when he fell from a ladder.,Unknown,31.1915437,-101.4603945,,,NC,7/27/12,"Southern Investments LLC, Reidsville, NC 27320",Worker cutting wire off baled recyclable plastics was killed after being pulled into an auger.,Unknown,36.3548586,-79.6644747,,,MA,7/11/12,"Far East Construction Inc., Cambridge, MA 02139",Worker performing construction activities died after falling from a ladder.,Unknown,42.3647559,-71.1032591,,,FL,7/26/12,"Colors Construction Inc., Boca Raton, FL 33487",Worker performing construction activities died when he was ejected nearly 30 feet from an aerial lift.,Unknown,26.411026,-80.0926014,,,OH,7/27/12,"ATW Automation Inc., Dayton, OH 45402",Worker operating a core pole assembly machine died after being caught in between two conveyors.,Unknown,39.7574433,-84.2094347,,,MI,7/29/12,"U.S. Postal Service, Allen Park, MI 48101",Worker was found unconscious with a serious head injury.,Unknown,42.2577,-83.214,,,PA,7/29/12,"Wildlife Specialists LLC, Canton, PA 17724",Worker using metal poles to catch bats was electrocuted when the poles touched power lines.,Unknown,41.656464,-76.8532927,,,CA,7/30/12,"Bimbo Bakery, Galt, CA 95632",Worker was crushed by a rack of baked goods.,Unknown,38.2546373,-121.2999485,,,IN,7/30/12,"Hillcrest Supply Inc., Montgomery, IN 47558",Worker at feed mill loading a feeding truck fell while standing on a 9-inch beam.,Unknown,38.6625493,-87.0461181,,,IL,7/30/12,"Soudan Metals Company Inc., Chicago, IL 60609",Worker processing a coil of rolled steel was struck by the steel roll and pinned between the roll and processing line.,Unknown,41.8062766,-87.6482474,,,CO,7/31/12,"Mountain Barricade, Westcliffe, CO 81252",Worker doing flagging operations was struck and killed by a vehicle.,Unknown,38.1347219,-105.4658353,,,TX,7/31/12,"Texas TST Inc., Sweetwater, TX 79556",Worker at a metals refinery plant collapsed and died from possible heat stress.,Unknown,32.4709519,-100.4059384,,,CA,8/1/12,"Golden State Elevators Inc., Paramount, CA 90723",Worker performing repairs to an elevator fell 26 feet.,Unknown,33.8894598,-118.1597911,,,NV,8/1/12,"Roc Equipment, Clark, NV 89015",Worker performing work on a drill rig died from exposure to hydraulic fluid after a cylinder cracked from extreme pressure.,Unknown,36.0552472,-114.9279547,,,WI,8/1/12,"Spacesaver Corporation, Fort Akinson, WI 53538",Worker was crushed by falling sheet metal.,Unknown,42.9164307,-88.8455037,,,NM,8/3/12,"Clovis Sign Service Inc., Clovis, NM 88101",Worker installing a billboard was electrocuted when metal from the sign touched a power line.,Unknown,34.4047987,-103.2052272,,,NC,8/3/12,"NC Department of Transportation, Murphy, NC 28906",Two workers were struck-by and pinned against the back of a dump truck after being hit by a vehicle.,Unknown,35.0875836,-84.0346315,,,IN,2/15/12,"Otwell Mercantile, Otwell, IN 47564",Worker died from asphyxiation while performing maintenance on a tractor inside a closed garage.,Unknown,38.5118249,-87.0824045,,,TX,5/24/12,"Bird Ranch, Andrews, TX 79714",Worker checking windmills died after falling from structure.,Unknown,32.040523,-102.1324657,,,TX,7/20/12,"Affordable Mobile Home Movers, Channelview, TX 77530",Worker died from possible electrical shock.,Unknown,29.7760599,-95.1146533,,,FL,8/1/12,"J&M Contractors of South Florida Inc., Parkland, FL 33067",Roofing worker died after falling from a structure onto the ground.,Unknown,26.3088869,-80.2209773,,,FL,8/2/12,"Ames Group LLC, Homestead, FL 33035",Worker collapsed and hit his head on a pipe. Worker suffered a possible heart attack.,Unknown,25.4687224,-80.4775569,,,FL,8/2/12,"Best-Tec Asbestos Abatement Inc., West Palm Beach, FL 33401",Employee died after falling approximately 12 feet while removing ceiling tiles.,Unknown,26.7153474,-80.0533253,,,FL,8/2/12,"D&B Builders Inc., Fort Walton Beach, FL 32577",Worker died after falling 15 feet out of a trash box being lifted by a forklift.,Unknown,30.7542485,-87.3612205,,,NJ,8/3/12,"Jersey Central Power & Light Company, Manalapan, NJ 07726",Employee was electrocuted while working on a downed wire.,Unknown,40.2969444,-74.33,,,ND,8/6/12,"Big Sky Well Service Inc., Killdeer, ND 58640",Worker died after falling approximately 75 feet from a service rig.,Unknown,47.3719582,-102.7540751,,,NJ,8/6/12,"D.R. Exteriors LLC, West Milford, NJ 07480",Roofing worker died after falling approximately 30 feet from a residential roof.,Unknown,41.0985461,-74.3939339,,,OH,8/6/12,"Glatfelter Paper, Chillicothe, OH 45601",Worker operating a bulldozer died when he was runover by the machine while trying to jump from it when it caught fire.,Unknown,39.3331197,-82.9824019,,,IN,8/6/12,"Rowlett Tree Service, Henryville, IN 47126",Worker was crushed by a tree that was being cut down.,Unknown,38.5417282,-85.7677438,,,WI,8/7/12,"ACH Foam Technologies, Fon Du Lac, WI 54937",Worker died from severe abdominal injuries after being crushed by a pneumatic door.,Unknown,43.7597419,-88.3433623,,,NV,8/9/12,"Rocky Mountain Recycling, Las Vegas, NV 89030",Worker at a recycling facility was crushed under a forklift after it tipped over.,Unknown,36.2040034,-115.1296249,,,KY,8/10/12,"Louisa Water and Sewer District, Louisa, KY 41230",Worker operating vehicle died when it rolled down an embankment.,Unknown,38.1142544,-82.6032119,,,GA,8/9/12,"AAA National USA Inc., Atlanta, GA 30303",Worker died after being struck by lightning while collecting his tools from a roof.,Unknown,33.755711,-84.3883717,,,GA,8/10/12,"D.J.S. Tractor and Trailer Service Inc., Conley, GA 30288",Worker was killed when he was pinned beneath the cab of a yard tractor he was repairing.,Unknown,33.6379499,-84.336605,,,IL,8/15/12,"Union Pacific Railroad Company, Deer Grove, IL 61243",Worker was killed after an 18-wheeler delivering a machine struck the worker.,Unknown,41.607811,-89.689547,,,FL,8/16/12,"Bacardi Bottling Corp., Jacksonville, FL 32218",Worker cleaning up broken glass at a bottling plant died after being crushed by a machine that molds materials into pellet shapes.,Unknown,30.4686832,-81.6692532,,,AK,8/16/12,"Hammett Electric Inc., Wooster, AK 72181",Worker was electrocuted while installing wiring at a residence under construction.,Unknown,35.1653807,-92.4529976,,,PA,8/16/12,"Osmic Inc., Titusville, PA 16354",Worker died after falling 30 feet while removing bolts from a crane rail.,Unknown,41.6270036,-79.6736631,,,UT,1/25/12,"RH Construction Inc., Salt Lake City, UT 84108",Three workers were hospitalized after they were injured by a partially collapsed roof.,Unknown,40.7834328,-111.7376178,,,IL,8/9/12,"R&A Construction of Illinois Inc., Willowbrook, IL 60527",Worker died from chemical burns after a varnish applied to a floor caught fire.,Unknown,41.7697533,-87.9358931,,,MD,8/14/12,"Best Blue Inc., Ellicott City, MD 21043",Worker putting up a pump jack scaffold was electrocuted after contacting a 7,600-volt phase line.,Unknown,39.2369558,-76.7913558,,TX,8/15/12,"GEM Drilling, Aspermont, TX 79502",Worker died after falling backwards while on the drillling floor of a rig.,Unknown,33.1334307,-100.2273276,,,ND,8/15/12,"Steamboat Energy Consultants, Williston, ND 58801",Worker overseeing the operation of an oil rig was struck and killed by a truck.,Unknown,48.1469683,-103.6179745,,,TX,8/16/12,"Andrews Transport LP., Houston, TX 77049",Worker died from severe head injuries after falling from a tractor trailer.,Unknown,29.8390871,-95.1536327,,,MI,8/21/12,"Oakland County Road Commission, Beverly Hills, MI 48025",Worker operating a dump truck used for road resurfacing was killed when truck rolled into a ditch.,Unknown,42.5164202,-83.2627997,,,MN,8/21/12,"White Brothers Logging, Cass Lake, MN 56633",Worker was struck and killed by tree pines that slipped out of boom truck.,Unknown,47.4287963,-94.5205566,,,NM,8/21/12,"Wiggle Tails Oil Field Service Inc., Bloomfield, NM 87413",Worker was crushed under the rear wheels of a truck.,Unknown,36.7111165,-107.9845116,,,TN,8/21/12,"Yumoto Company Ltd, Dechard, TN 37324",Worker at an automobile assembly plant was crushed in machine.,Unknown,35.2585083,-85.9917437,,,CA,8/22/12,"David Girard Vineyard, Placerville, CA 95667",Worker at a vineyard was crushed in a wine press.,Unknown,38.7296252,-120.798546,,,IN,8/7/12,"SSI Services LLC, Indianapolis, IN 46217",Worker inside an asbestos pulverizing unit died from injuries after a combustible dust explosions occurred when equipment malfunctioned.,Unknown,39.661576,-86.1853474,,,IL,8/11/12,"Effingham County Fair - Board of Directors, Altamont, IL 62411",Worker was struck and killed by a payloader that was moving concrete barriers.,Unknown,39.061988,-88.7481108,,,WA,8/15/12,"J&J Trucking, Vancouver, WA 98660",Worker driving a loaded gravel truck was killed when the brakes failed causing vehicle to strike trees.,Unknown,45.6837914,-122.7488096,,,WY,8/20/12,"COP Wyoming LLC, Sheridan, WY 82801",Worker was struck and killed by the bucket of a backhoe while inside a trench box.,Unknown,44.8302484,-106.8986415,,,WY,8/21/12,"Baker Hughes, Casper, WY 82601",Worker at a chemical products warehouse was crushed under a 4,000-pound storage container.,Unknown,42.866632,-106.313081,,KY,8/25/12,"Jorge Vargas dba Jorge Vargas Martinez, Louisville, KY 40291",Worker using a ladder to install brick board died after falling off the ladder.,Unknown,38.1173105,-85.5715015,,,WA,8/25/12,"ZIA Construction and Contracting Inc., Cheney, WA 99004",Worker sheeting the roof on a two-story building suffered fatal head injuries after falling 21 feet to the ground.,Unknown,47.4873895,-117.5757622,,,IN,8/27/12,"Amerifence Inc., Indianapolis, IN 46226",Worker for a fence company sweeping the fence production area was electrocuted.,Unknown,39.8420351,-86.0427626,,,SC,8/27/12,"Edwards Construction Inc., Rock Hill, SC 29732",Worker preparing to cut tree limbs died after falling 40 feet to ground.,Unknown,34.9248667,-81.0250784,,,CA,8/30/12,"Hai Chang Inc., Bell, CA 90201",Worker was behind truck and was caught-between truck and loading dock.,Unknown,33.9775142,-118.1870156,,,FL,8/26/12,"All Florida Tree & Landscape Inc., Ft Lauderdale, FL 33126",Tree trimmer was electrocuted after contacting a power line,Unknown,25.778647,-80.2962385,,,FL,8/27/12,"Forward Air Solutions Inc., Medley, FL 33178",Worker died from head injuries after falling off of a conveyor.,Unknown,25.8406526,-80.3264404,,,VA,8/27/12,"H&W Logging, Tazewell VA 24651",Worker was killed after being run over by a skidder machine.,Unknown,37.1148374,-81.5195548,,,VA,8/29/12,"Home Crafters of Tidewater, Suffolk, VA 23435",Worker erecting a pump jack scaffold system was electrocuted when the pole he was using contacted a power line.,Unknown,36.84168,-76.4794435,,,CA,8/31/12,"Fireworks and Stage FX America Inc., Lake Elsinor, CA 92530",Worker was preparing aerial fireworks when an explosion occurred. Worker was hospitalized but succumbed to injuries on 9/2/2012.,Unknown,33.6392361,-117.3851496,,,PA,9/2/12,"Core-Mark International, Wilkes Barre, PA 18703",Worker operating a forklift died from head injuries after being struck by a beam.,Unknown,41.24,-75.89,,,PA,9/2/12,"GreenTek Roofing, Carnigie, PA 15106",Worker died after falling from a roof.,Unknown,40.4088514,-80.1149414,,,KY,9/2/12,"Smithfield Packing, Grayson, KY 41101",Worker electrocuted while rewiring a breaker panel for a smoke generator.,Unknown,38.4803833,-82.6537455,,,WA,9/3/12,"Bravo Environmental NW Inc., McKenna, WA 98580",Worker was killed in motor vehicle accident due to weather conditions.,Unknown,46.9426716,-122.4571136,,,NM,9/3/12,"High Desert Roofing, Farmington, NM 87401",Worker died after falling through a roof opening and hitting concrete floor.,Unknown,36.7280583,-108.2186856,,,PA,9/4/12,"HRI Inc., Bethlehem, PA 18015",Worker was crushed when a section of a road barrier fell on him.,Unknown,40.6259316,-75.3704579,,,TX,9/4/12,"Mullen Electric Co., Kyle, TX 78640",Employee repairing a lamp died after falling from a ladder and hitting his head.,Unknown,29.9891052,-97.8772267,,,TX,9/4/12,"Rangeline Tapping Services Inc., Cut and Shoot, TX 77306",Employee performing painting services died after being pinned by a 2,000-pound flange housing.,Unknown,30.3332654,-95.357994,,TX,9/5/12,"Industrial TX Corp., Webster, TX 77598",Worker was struck and killed by construction equipment.,Unknown,29.5377315,-95.1182645,,,VA,9/5/12,"M&C Electrical, Arlington, VA 22201",Worker was electrocuted while installing a conduit.,Unknown,38.8845126,-77.0938583,,,OH,9/6/12,"Select Sires Inc., Plain City, OH 43064",Worker was crushed between the gate and post of a pen when letting bulls out to feed.,Unknown,40.1075615,-83.2674165,,,OH,8/1/12,"Libbey Glass Inc., Toledo, OH 43697",Employee died from fall at work.,Unknown,41.64,-83.54,,,IL,8/11/12,"Effingtham County Fair, Board of Directors, Altamont, IL 62411",Worker struck and killed by a payloader used to move concrete barriers.,Unknown,39.061988,-88.7481108,,,WA,8/17/12,"Evan F. Hamilton, Prosser, WA 99350",Worker struck and killed by a grain harvesting machine.,Unknown,46.2067997,-119.7689222,,,FL,8/17/12,"Waste Pro USA Inc., Loxahatchee, FL 33470",Employee operating a waste truck was crushed when it tipped over.,Unknown,26.7727394,-80.3435908,,,NY,9/4/12,"NYCDPR Al Oreter Recreation Center, Maintenance Op, Ctr., Flushing, NY 11355",Worker was fatally stabbed during a verbal altercation with a garbage truck operator.,Unknown,40.7493096,-73.8213213,,,WI,9/5/12,"Pentair, Brookfield, WI 53045",Employee died from a head injury after falling from a chair.,Unknown,43.0532825,-88.1584129,,,CA,9/5/12,"Roger Elliot Construction, Penn Valley, CA 95946",Worker changing a truck tire struck and killed by a chain on an excavator bucket.,Unknown,39.196005,-121.1910659,,,TX,9/7/12,"Ameriwaste Inc., Santa Fe, TX 77510",Worker died after being pinned between truck and ground after truck rolled over into ditch.,Unknown,29.3780129,-95.1057625,,,PA,9/7/12,"J.R. Resources LP, Ringgold, PA 15570",Worker pumping fluid out of a plastic tank died when the tank exploded.,Unknown,40.9888618,-79.1706795,,,TX,9/10/12,"Pizzitola Guttering Co., Houston, TX 77007",Employee fell from ladder while performing work near gutter of house.,Unknown,29.7765065,-95.4201377,,,TX,9/10/12,"Stagg LLC, San Antonio, TX 78230",Employee died after slipping on a wet floor.,Unknown,29.542044,-98.555621,,,NY,9/10/12,"S&B Masonry Corp., Brooklyn, NY 11205",Employee died when a masonry wall collapsed on him.,Unknown,40.6945036,-73.9565551,,,WI,9/10/12,"Willman Industries Inc., Cedar Grove, WI 53013",Employee was crushed after being caught in a molding machine.,Unknown,43.5697201,-87.8234219,,,TN,9/11/12,"Elba Diaz, Mt. Juliet, TN 37122",Worker performing residential framing died after falling nine feet from the top of an interior wall.,Unknown,36.200055,-86.5186054,,,OH,9/12/12,"Grower's Chemical Corporation, Norwalk, OH 44857",Farm worker died after being struck in the head by a hooper wagon.,Unknown,41.2425531,-82.6157331,,,LA,9/12/12,"River Cities Machine LLC, Bossier City, LA 71111",Worker was killed after his shirt became caught in a lathe he was operating, pulling him into the machine.,Unknown,32.5159852,-93.7321228,,CA,9/13/12,"Delicato Winery Vineyard, Manteca, CA 95336",Worker unhitching a trailer died after he was run over by another driver.,Unknown,37.8403398,-121.2053963,,,NV,9/13/12,"Fisher Industries, Interstate 80 East Bound, Mile Post 392, NV 89521",Worker making repairs to a tire compactor was crushed between the compactor and a drum roller.,Unknown,39.3831391,-119.6499162,,,SC,9/14/12,"Belton Metal Company Inc., Belton, SC 29627",Worker run over and crushed by track hoe.,Unknown,34.5228881,-82.4942948,,,GA,6/29/12,"Williams Warehouse Inc, Plains, GA 31780",Employee died after falling from a roof through a skylight while removing metal panels.,Unknown,32.0340508,-84.3926912,,,MT,9/13/12,"Mr Asphalt Inc., Corvallis, MT 59828",Worker died after falling approximately 13 ft while checking the level of an asphalt oil tank.,Unknown,46.3140884,-114.1128734,,,MT,9/20/12,"Bonneville Power Administration, Saint Regis, MT 59866",Worker died after falling approximately 80 feet while replacing insulators.,Unknown,47.3023629,-115.0990702,,,NY,9/20/12,"Ryan's Tree Service, Chaumont, NY 13622",Worker died after being crushed by a chipper.,Unknown,44.0669987,-76.1302089,,,TX,9/21/12,"G.R. Birdwell Construction LP, Channelview, TX 77530",Worker was killed after being pinned between the dirt compactor he was operating and a wall.,Unknown,29.7760599,-95.1146533,,,TX,9/23/12,"Archer Underbalanced Services, Boys Ranch, TX 79010",Worker was killed while repairing an air compressor after a 2-inch line separated and struck employee in the chest.,Unknown,35.4580118,-102.197583,,,GA,9/24/12,"KAYCO Erectors Inc, Sugar Hill, GA 30518",Employee died after falling through floor hole while installing metal decking.,Unknown,34.1064895,-84.0335197,,,LA,9/24/12,"SITI, Rayne, LA 70578",Worker was pouring concrete when he was struck and killed by a vehicle being driven by another employee.,Unknown,30.234925,-92.2684617,,,IL,9/25/12,"Jet Import Inc, Chicago, IL 60608",Worker died after being struck on the head by a pallet that had fallen from a trailer he was preparing to unload.,Unknown,41.848922,-87.6695189,,,AL,9/26/12,"Advanced Recycling Center, Brewton, AL 36426",Worker was crushed when bucket of skid loader fell on him when he crawled under machine to disconnect a hydraulic line.,Unknown,31.1051779,-87.0721918,,,