MS,4/9/12,"Omega Protein, Moss Point, MS 39562",Worker at a seafood plant was killed when he was caught in a conveyor used to move liquids and grain materials.,Unknown,30.4115881,-88.5344601,,,IL,4/9/12,"S & J Construction Co. Inc., Chicago, IL 60633",Worker was performing steel erection activities and was crushed by a steel beam.,Unknown,41.6602362,-87.564304,,,MD,4/10/12,"274 East Memorial LLC, Hagerstown, MD 21740",Worker on the back of a small vehicle used for hauling trash died from injuries after he was thrown from the vehicle when it made a turn.,Unknown,39.6417629,-77.7199932,,,MD,4/10/12,"Potomac Abatement Inc., Silver Spring, MD 20910",Worker for an environmental hazards solutions company died after falling 10 stories from a self-lifting scaffold.,Unknown,39.0041504,-77.0391754,,,TN,4/12/12,"TN Aluminum Processors Inc., Mt. Pleasant, TN 38474",Worker loading aluminum into a shredder was killed after being pulled into the machine.,Unknown,35.5342414,-87.2069541,,,NM,4/13/12,"Shamrock Foods, Albuquerque, NM 87120",Worker at a food processing facility was killed when an elevated docking board used to fill the gap between a trailer and loading dock fell and struck his head.,Unknown,35.1509567,-106.7470536,,,NY,11/17/11,"Dragados USA/Judlau, New York, NY 10017",Worker using a concrete sprayer during tunnel repairs was struck and killed by falling concrete.,Unknown,40.7519846,-73.9697795,,,NY,2/10/12,"Star Wars Technology Systems Inc., New York, NY 10007",Worker installing heat control cabling died after falling off a ladder and hitting his head on the concrete floor.,Unknown,40.7136487,-74.0087126,,,MN,3/14/12,"Premier Precision Group-Sternel, Plymouth, MN 55441",Worker performing painting services died from cardiac arrest.,Unknown,45.0105194,-93.4555093,,,AL,4/9/12,"Doyon Drilling Inc., Prudhoe Bay, AL 99734",Worker performing rig operations offshore died after he was caught between a pipe elevator support and a generator room wall.,Unknown,70.2533244,-148.3495937,,,PR,4/9/12,"Ferreteria Maderas 3C, San Juan, PR 00920",Worker in a warehouse shipping and receiving area was struck and killed by a vehicle.,Unknown,18.4100746,-66.0909634,,,IL,4/9/12,"Village of Romeoville- Public Works, Romeoville, IL 60446",Worker was struck and killed by a public works vehicle.,Unknown,41.6475306,-88.0895061,,,CA,4/9/12,"Yorba River Inc. dba Pro-Towing, Chino, CA 91710",Worker performing maintenance on a tow truck was killed when he was hit and dragged by the moving truck.,Unknown,34.0120229,-117.6786847,,,CO,4/11/12,"Roggen Farmers Elevator Association, Roggen, CO 80652",Worker loading a large empty sila plastic bag into a mechanical device died when his body became caught in the bagging mechanism.,Unknown,40.1688174,-104.3719342,,,UT,4/18/12,"Hansen Design Specialty Flooring Inc., Draper, UT 84020",Worker was struck and killed by a vehicle while performing maintenance in a storm drain.,Unknown,40.4960215,-111.8687825,,,NC,4/18/12,"Lewis Nursery and Farms Inc., Rocky Point, NC 28457",Worker was killed after his leg became caught in coiled rope that was being pulled onto a post by a spooling machine.,Unknown,34.4350957,-77.8877304,,,CA,4/19/12,"Erosion Control Applications Inc., Hinkley, CA 92347",Worker using a bobcat and boom lift to remove an aluminum tube that was stuck inside a liner roll died from head injuries when he became pinned between bobcat and its frame.,Unknown,34.9344769,-117.1993469,,,CA,4/19/12,"OFC Transport, Wilmington, CA 90744",Worker refueling his truck was killed when the truck moved forward and rolled over him.,Unknown,33.7857948,-118.2643567,,,CA,4/20/12,"Key Energy Services Inc., Fellows, CA 93224",Worker was struck and killed while trying to stop his truck from rolling downhill.,Unknown,35.1785779,-119.5412328,,,NC,3/24/12,"A and A Farms Inc., Bunnlevel, NC 28323",Farm worker was killed after a box of seed potatoes fell on him.,Unknown,35.3096063,-78.7802994,,,MS,4/10/12,"Parker Logging, Brandon, MS 39042",Worker cutting down trees was struck and killed by a falling tree.,Unknown,32.2732024,-89.9859158,,,NJ,4/14/12,"D Barro Landscaping Service Inc., Leonia, NJ 07605",Worker repairing an uprooted sidewalk at a construction site was crushed after a concrete slab hanging from a bobcat fell on him.,Unknown,40.8614887,-73.9881942,,,GA,4/17/12,"A.F.R. of Georgia Inc., Winder, GA 30680",Worker at a fiberglass manufacturing facility died after suffering a seizure.,Unknown,33.9926097,-83.7201709,,,FL,4/17/12,"General Asphalt Co. Inc., Deerfield Beach, FL 33441",Worker repaving part of a highway was killed after being run over by a dump truck.,Unknown,26.3058811,-80.0926014,,,CO,4/24/12,"Evraz Rocky Mountain Steel, Pueblo, CO 81004",Worker was run over and killed by a powered industrial truck.,Unknown,38.2544472,-104.6091409,,,IA,4/24/12,"Oxton Transport Inc., Red Oak, IA 51566",Driver on top of transport trailer while monitoring levels of liquid fertilizer died after falling to the concrete after suffering a stroke.,Unknown,41.0116667,-95.2272222,,,NE,4/24/12,"Quality Power & Control, Allen, NE 68710",Worker performing electrical services was electrocuted.,Unknown,42.4151088,-96.8424713,,,IL,4/24/12,"Wigand Disposal Company, Princeville, IL 61559",Worker collecting garbage died after he was run over by the trash truck.,Unknown,40.9297591,-89.7576021,,,IN,4/26/12,"PJE Lawn Care, Greenfield, IN 46163",Landscape worker using a tractor with attached chain to remove a tree stump drowned when the chain failed, causing the tractor to roll into a pond, trapping him underwater.,Unknown,39.7243229,-85.9100089,TX,3/28/12,"Delta Construction, Plano, TX 75075",A worker at a construction site was killed after a catering truck hit him.,Unknown,33.0208716,-96.7386946,,,TX,3/28/12,"Indus Construction LP, San Antonio, TX 78210",Bridge worker installing rebar was killed after falling 18 feet.,Unknown,29.3979578,-98.4677851,,,NY,4/13/12,"Peekskill City Dept. of Public Works, Peekskill, NY 10566",Worker for a public works department suffered head trauma after falling from a truck.,Unknown,41.2900939,-73.9204158,,,LA,4/16/12,"Marcella Juarez Concrete, Mandeville, LA 70448",Construction worker was struck and killed by lightning while pouring a concrete slab.,Unknown,30.3582506,-90.0656311,,,TX,4/18/12,"MEI Rigging and Crating, Dallas, TX 75235",Worker was run over and killed by a forklift used to deliver materials at a construction site.,Unknown,32.8296623,-96.8511814,,,OK,4/21/12,"Dan D. Drilling Inc., Capron, OK 73717",Worker for a drilling company died when he fell from a derrick platform to the rig floor.,Unknown,36.8966959,-98.5775806,,,OK,4/23/12,"Horizon Energy Services LLC, Oklahoma City, OK 73135",Drilling worker was killed when a hydraulic line used to lift machinery broke, pinning him underneath the equipment.,Unknown,35.3922378,-97.4273195,,DC,4/28/12,"DSNK Corporation, Washington, DC 20002",Worker lifting guardrails up to a third floor balcony died when the guardrail he leaned against collapsed, causing him to fall 21 feet to the concrete.,Unknown,38.9052763,-76.9815877,,TX,4/28/12,"ISM Insulation, Magnolia, TX 77355",Worker using scaffold to spray foam insulation on a wall died after his ladder slipped, causing him to fall.,Unknown,30.2093794,-95.7507815,,TX,4/30/12,"ConocoPhillips, Borger, TX 79008",Worker installing hydraulics at a silo chute died from a 20-foot fall when the chute moved to a vertical position.,Unknown,35.672082,-101.3925454,,,LA,5/3/12,"Allison Marine Contractors, Amelia, LA 70340",Marine contract worker unhooking a pressure vessel from a crane line was killed when the vessel tipped over and fell on him.,Unknown,29.6617351,-91.1052203,,,LA,5/3/12,"Frank's Casing Crew & Rental Tools, Lafayette, LA 70508",Worker at a tool company helping to move iron pipes was crushed when one of the pipes rolled over him.,Unknown,30.154741,-92.037116,,,CA,5/3/12,"Ken's Firewood, Colusa, CA 95932",Worker performing demolition work was killed after a wall collapsed.,Unknown,39.2143343,-122.0094175,,,IN,5/4/12,"Walsh Construction, Madison, IN 47250",Worker was operating an aerial lift and became wedged between the lift basket and beam.,Unknown,38.7358933,-85.3799577,,,NC,5/8/12,"Knott Construction Inc., Forest City, NC 28043",Worker at a construction site was killed after he was hit on the head by a steel pipe that broke from a piece of scrap metal.,Unknown,35.3340108,-81.8651028,,,GA,5/7/12,"Malon D Mimms, Roswell, GA 30075",Worker on a roof taking measurements of the HVAC units died after falling 21 feet.,Unknown,34.0586259,-84.3857442,,,MO,5/7/12,"Penzel Construction Co., Inc., Jackson, MO 63755",Worker assembling a crawler crane at a construction site was killed when his head was crushed between the crane's uncarriage and support pads.,Unknown,37.3822732,-89.6662063,,,MO,5/7/12,"Schoeder & Tremayne, St. Louis, MO 63123",Warehouse worker operating a forklift died when the metal plate that bridges the gap between the loading dock and truck gave way, causing him to fall 6 feet off the dock.,Unknown,38.5580845,-90.3277829,,TN,5/7/12,"TAG Manufacturing Inc., Chattanooga, TN 37421",Worker stepped into an auger pit and became caught in the auger.,Unknown,35.041539,-85.1583064,,,CO,5/8/12,"High Ball Erector LLC, Boulder, CO 80303",Worker conducting steel erection activities was fatally wounded.,Unknown,40.0005378,-105.2077798,,,FL,5/8/12,"Intercostal Roofing Solutions LLC, Orchid, FL 32967",Worker laying down sealant on a roof died after falling 40 feet to the cement ground.,Unknown,27.7242715,-80.4660256,,,OR,5/9/12,"Allen & Gibbons Logging Inc., Canyonville, OR 97417",Worker had just set chokers in a unit of tree length on steep terrain. When the lines came tight, the log swung forward and struck the victim in the chest and head.,Unknown,42.9273406,-123.2811748,,MO,5/9/12,"Contractors Roofing & Supply Co., Lake Sherwood, MO 63357",Worker was electrocuted when the boom of the roofing supply truck contacted power lines hidden within tree branches.,Unknown,38.6686491,-91.1161166,,,PA,5/9/12,"DLS Tree Services, Edgeworth, PA 15143",Worker was electrocuted when the pole saw he used to trim trees touched an overhead power line.,Unknown,40.5529158,-80.1927855,,,IN,5/9/12,"Milestone Contractors, Indianapolis, IN 46204",Worker was walking in a private homeowner's yard and was struck by a motor vehicle.,Unknown,39.7713425,-86.1573709,,,CA,5/10/12,"Roya and Isaac Musighi, Beverly Hills, CA 90210",Worker inside an unshored trench at a residential construction site was asphyxiated when the trench collapsed.,Unknown,34.0736204,-118.4003563,,,LA,5/10/12,"Savanna Energy Services, Keatchie, LA 71046",Worker on a drilling rig was killed when his equipment was entangled in a mechanical unit, pulling him off the rig.,Unknown,32.1366223,-93.9266502,,IN,5/11/12,"Hoosier A1 Sanitary Sewer Services, New Castle, IN 47362",Worker was reeling in a high pressure water hose when the nozzle whipped around and the high pressure water cut the worker's carotid artery.,Unknown,39.928935,-85.3702476,,,CA,5/12/12,"CA Department of Justice, Sacramento, CA 95814",Worker passed away from cancer, one day after retiring. Worker was exposed to gas fumes and cleaning solvents while on duty. Not work-related.,Unknown,38.5798663,-121.4883489,,IA,5/12/12,"Wal-Mart Stores Inc., Fairfield, IA 52556",Worker was leaving store while on break, tripped on an outside curb and sustained head injuries.,Unknown,41.0072222,-91.9658333,,FL,5/14/12,"Logistec USA Corp., Palmetto, FL 34221",Worker performing marine cargo handling activities was killed when a crane fell on him.,Unknown,27.5214269,-82.5723193,,,WV,5/14/12,"Preston Memorial Hospital, Kingwood, WV 26537",Worker was killed after being struck by an elevator inside a hospital elevator shaft.,Unknown,39.4650839,-79.6879208,,,TX,5/15/12,"Hightower Electric Company Ltd., Houston, TX 77066",Worker installing light fixtures in a remodeled building died when he fell off ladder after contacting live wiring.,Unknown,29.9631614,-95.509247,,,CA,5/15/12,"Viking Construction, Chico, CA 95926",Worker was widening freeway and fell approximately six feet.,Unknown,39.7461315,-121.8448745,,,TX,5/16/12,"Circle C, Odessa, TX 79763",Worker extracting water from a well was found dead inside well.,Unknown,31.8352547,-102.4084436,,,LA,5/17/12,"Airport Road, New Orleans, LA 70113",Worker cutting grating on a ladder died from a 9-foot fall when a piece of the grating fell on him.,Unknown,29.9901308,-90.2479376,,,NY,5/17/12,"Bras-Al Construction Corp., New York, NY 10013",Worker on a construction site died after falling two stories from a scaffold and landing on a sidewalk shed.,Unknown,40.7217861,-74.0094471,,,LA,5/17/12,"Breaux's Mini-Mart, Lafayette, LA 70501",Worker cutting meat at a market died from severe bleeding when he blacked out, falling onto a saw.,Unknown,30.2476472,-91.9979411,,WA,5/17/12,"SSA Marine Inc., Seattle, WA 98134",Worker was caught-in-between forklift and forklift's overhead protection after climbing over steering wheel and inadvertently activating controls.,Unknown,47.583863,-122.3406748,,,CA,5/18/12,"ABM Facility Services Inc., Ontario, CA 91767",Building maintenance worker changing a device used to stabilize the current in an electrical circuit was electrocuted.,Unknown,34.0836851,-117.7432015,,,WA,5/5/12,"Americold Logistics LLC, Tacoma, WA 98424",Warehouse worker stranded on a platform 35 feet high after his forklift malfunctioned died when he fell from another forklift used to rescue him.,Unknown,47.2324122,-122.3473803,,,WI,5/17/12,"Priemo Homes, Siren, WI 54872",Worker performing roofing activities died after collapsing on the roof.,Unknown,45.7857818,-92.3810284,,,NJ,5/18/12,"ASAP Seamless Gutters, Secaucus, NJ 07094",Worker died after being ejected from a 40-foot high aerial lift basket.,Unknown,40.7895453,-74.0565298,,,PA,5/18/12,"Brandywine Railroad Subsidiary of Arcelor Mittal, Conshohocken, PA 19428",Railroad worker, who opened up the door to a railcar containing rolls of paper, was crushed when the paper rolls fell on him.,Unknown,40.0792766,-75.3015714,PA,5/19/12,"Sandmeyer Steel Company, Philadelphia, PA 19116",Worker painting a fence was struck and killed by a moving vehicle.,Unknown,40.1145029,-75.0085399,,,PA,5/22/12,"American Contracting Enterprises Inc., Pittsburgh, PA 15206",Worker performing asbestos removal was electrocuted.,Unknown,40.4720642,-79.9136731,,,IL,5/22/12,"Arens Controls Company LLC, Arlington Heights, IL 60004",Worker testing energy components for use in hybrid vehicles was killed when an explosion occurred.,Unknown,42.1099506,-87.9824758,,,CA,5/22/12,"Boss 4 Packing LLC, Heber, CA 92249",Worker died from possible heat stress after becoming unconscious while harvesting cantaloupes outdoors.,Unknown,32.7308911,-115.529718,,,IL,5/22/12,"Briteway Stripping Services Inc., Fairview Heights, IL 62208",Road construction worker was struck and killed by a motorist.,Unknown,38.5889386,-89.990382,,,MI,2/21/12,"Department of Human Services, Grand Rapids, MI 49507",A caseworker was shot and killed by a client who was upset about his benefits being denied.,Unknown,43.118051,-85.510167,,,NY,5/21/12,"Rainbow Land Nursery School Inc., Woodside, NY 11377",Worker fell from a ladder.,Unknown,40.7512123,-73.9036487,,,PA,5/24/12,"Zimmerman Manufacturing LLC, New Holland, PA 17557",Worker in a manufacturing facility was killed when he fell 12 feet from a skid loader machine.,Unknown,40.1017643,-76.085227,,,NY,5/25/12,"Delsignore Blacktop Paving Inc., East Greenbush, NY 12061",Worker lowering a tall light mast used to illuminate large areas was electrocuted when the light fixture touched a power line.,Unknown,42.5909135,-73.7017858,,,TN,5/25/12,"E.T.C. Inc., Stantonville, TN 38379",Worker was struck by a truck backing into the dock area.,Unknown,35.1584164,-88.4258762,,,OH,5/25/12,"Espinoza Construction, Cincinnati, OH 45237",Worker performing roof repairs at a residential site died after falling off the roof.,Unknown,39.1940851,-84.4540213,,,FL,5/25/12,"Ocala Electric Utility, Ocala, FL 34482",Worker was electrocuted while repairing a damaged transmission line.,Unknown,29.2645726,-82.2800546,,,ND,5/25/12,"Scott's Electric Inc., West Fargo, ND 58078",Worker installing electrical conduits in a building under construction was struck on the head and killed by a 28-foot steel beam.,Unknown,46.8769487,-96.8999057,,,MO,5/25/12,"Tri-State Timber LLC, New Cambria, MO 63558",Worker cutting down trees died when a tree fell on him.,Unknown,39.7753068,-92.7504708,,,MN,5/28/12,"Verso Paper, Sartell, MN 56307",Worker at a paper mill was killed when an air compressor inside the building exploded, causing a fire.,Unknown,45.6024378,-94.6106841,,MO,5/29/12,"Jim's Disposal Service LLC, Kansas City, MO 64118",Worker riding on the back of a trash truck was killed when he fell off and was run over by the truck.,Unknown,39.220735,-94.5727598,,,TX,5/30/12,"Precision Drilling, Orange, TX 77631",Worker performing drilling operations 3,500 feet below the surface was found dead on rig stairs leading to a mud tank.,Unknown,30.0941675,-93.7331813,,OH,5/31/12,"Nelson Tree Service Inc., Youngtown, OH 44501",Worker clearing trees from power lines died after falling 45 feet.,Unknown,41.0976439,-80.646912,,,TX,5/31/12,"Reeco Well Services, Mentone, TX 79754",Worker for an oil and gas producer was killed after being struck on the back by a block while working on a rig floor.,Unknown,31.81881,-103.6594267,,,WI,5/31/12,"Steel Structures Inc., Wausau, WI 54401",Worker standing inside a forklift bucket to change a ceiling light was killed when the forklift rolled, causing him to fall to the floor.,Unknown,44.9591352,-89.6301221,,MS,6/1/12,"Mississippi Phosphates Corp., Pascagoula, MS 39581",Worker died from burns after a pipe from the steam system he was checking exploded.,Unknown,30.3657552,-88.5561272,,,CA,6/1/12,"Temp Handbody Farm Labor Services, Huron, CA 93234",Farm worker pruning fruit trees died from possible heat stress.,Unknown,36.2027308,-120.1029177,,,NC,6/1/12,"Waukesha Electric Systems Inc., Goldsboro, NC 27530",Worker died from electrical burns received while testing a transformer.,Unknown,35.3848841,-77.9927651,,,TX,6/2/12,"L-Con Inc., Houston, TX 77015",Worker welding a pipeline that once contained crude oil died when an explosion occurred.,Unknown,29.7690048,-95.1744903,,,OH,6/4/12,"Arcelor Mittal Columbus LLC, Columbus, OH 43207",Worker for a steel products manufacturer died after complaining of pain.,Unknown,39.9119721,-82.9716617,,,LA,6/4/12,"Oil States Industries, Houma, LA 70363",Worker inside a fabrication shop was killed when a wall collapsed on him,Unknown,29.5957696,-90.7195348,,,CA,6/5/12,"Kurt Clark dba Clark's Concrete, Newcastle, CA 95658",Worker was killed when a wall under demolition collapsed on him.,Unknown,38.8736824,-121.1338884,,,MI,6/5/12,"Renewed Earth, Otsego, MI 49078",Worker operating a screening machine was killed when he was pulled into the machine.,Unknown,42.4605904,-85.696406,,,SD,6/5/12,"Simon Contractors, Caputa, SD 57725",Worker operating an asphalt roller died after the machine tipped over, crushing him underneath.,Unknown,43.9365164,-102.8514837,,PA,6/6/12,"Jay Springer Contracting, Ligonier, PA 15658",Worker died after falling off of roof he was repairing.,Unknown,40.2431278,-79.2375325,,,CA,6/6/12,"Live Nation, Universal City, CA 91608",Worker fell 60 feet from scaffolding while working inside an amphitheater.,Unknown,34.1361007,-118.3519973,,,MN,6/5/12,"Veit & Company Inc., Rogers, MN 55374",Worker operating a drill rig died from head trauma when he fell from the machine's broken seat.,Unknown,45.1878015,-93.5525206,,,CA,6/13/12,"NOSWerks, Los Angeles, CA 90007",Worker was killed when bottles of nitrous oxide exploded.,Unknown,34.0295114,-118.2848199,,,NC,6/13/12,"Parmass Holdings Inc. dba Envision Plastics, Reidsville, NC 27323",Worker performing equipment maintenance was electrucuted.,Unknown,36.36,-79.67,,,TX,6/14/12,"Camino Agave Inc., Yorktown, TX 78164",Worker hydrotesting two pipelines was struck and killed by the pressure testing equipment.,Unknown,28.9810888,-97.5027719,,,OR,6/15/12,"Millicoma Logging LLC, Ten Mile, OR 97420",Worker was fatally injured when a log being lifted by equipment broke and fell on his chest.,Unknown,43.3531842,-124.078232,,,MI,6/18/12,"Mill Steel Company, Grand Rapids, MI 49508",Worker moving steel coils was crushed when one of the 8,000-pound coils fell on him.,Unknown,42.8683658,-85.6332093,,OK,6/18/12,"Universal Roofing & Sheetmetal, Inc., Norman, OK 73014",Worker died from a 50-foot fall while repairing a roof.,Unknown,35.6172323,-98.1557066,,,CA,6/18/12,"Waste Management, San Leandro, CA 94577",Worker in a waste management plant was struck and killed by a bulldozer.,Unknown,37.7199247,-122.1689284,,,SD,6/18/12,"Zandstra Construction, Faith, SD 57626",Worker operating an asphalt roller was pinned underneath the machine when it rolled over into a ditch.,Unknown,45.0230391,-102.0359924,,,DC,6/19/12,"A & S Trucking, Washington, DC 20018",Worker picking up mail from an office trailer was struck and killed by a dump truck.,Unknown,38.9274061,-76.9729472,,,NC,6/22/12,"Dustin Ellis dba Dustin Ellis Logging, Stanley, NC 28164",Worker cutting down trees was killed when a tree struck him.,Unknown,35.3590256,-81.0970214,,,FL,6/9/12,"Recycling Services of Indiantown LLC, Indiantown, FL 34956",Worker using a torch to cut a propane tank died from burns suffered when the propane ignited, causing a fire.,Unknown,27.0272756,-80.4856083,,FL,6/12/12,"Dynamic Concrete Solutions LLC, Tampa, FL 33610",Worker performing roof repairs died after falling 60 feet.,Unknown,28.0007147,-82.3831561,,,GA,6/13/12,"Electrical Contractor Inc., Augusta, GA 30906",Worker making electrical repairs was electrocuted after touching a nearly 300-volt line.,Unknown,33.380425,-81.9752995,,,NY,6/13/12,"Erie County Medical Center, Buffalo, NY 14215",Hospital worker was shot and killed.,Unknown,42.9271305,-78.829227,,,TN,6/13/12,"Scruggs Equipment Company, Memphis, TN 38113",Worker was killed when a garbage truck he was working on activated, pinning his head.,Unknown,35.1059719,-90.0992722,,FL,6/14/12,"Ball Fabrics Inc., Deland, FL 32720",Worker making roof repairs fell 35 feet through a skylight.,Unknown,29.028318,-81.3031179,,,CO,6/14/12,"Dragon Man's Shooting Range, Colorado Springs, CO 80929",Worker on the set of a TV show was killed by a smoke bomb.,Unknown,38.828737,-104.6354631,,,MI,6/14/12,"M. G. Dyess Inc., DeKalb, MI 39328",Worker was crushed by pipes after the strap holding a load of pipes together broke.,Unknown,32.7563034,-88.6723578,,,MN,6/21/12,"BPS Inc., Minneapolis, MN 55413",Worker at a metal manufacturing facility was killed after being crushed by a pile of steel.,Unknown,44.9956414,-93.258095,,,WA,6/21/12,"National Park Service Paradise Station, Longmire, WA 98397",National parks service worker attempting to rescue climbers was killed after falling 3,000 feet down a mountain.,Unknown,46.76787,-121.79115,,IL,6/22/12,"Village of Central City - Public Works Department, Central City, IL 62801",Worker was killed when a burning tree limb fell on his head.,Unknown,38.5489379,-89.127014,,,OH,6/25/12,"Bob Evans Restaurant, Streetsboro, OH 44241",Restaurant worker died from surgical complications after falling and fracturing her right hip.,Unknown,41.2392227,-81.3459405,,,IL,6/26/12,"Jason Inc., Benton, IL 62812",Collision of two Sea-Doo boats being demonstrated by manufacturer, one worker fatality.,Unknown,37.9967163,-88.9200685,,MS,6/26/12,"Lane Line LLC, Brookhaven, MS 39601",Worker performing measurements inside a workzone was struck and killed by a company truck.,Unknown,31.5790588,-90.4406506,,,FL,6/27/12,"Florida Natives Nursery Inc., Englewood, FL 33565",Worker drowned after being pinned underwater by an overturned dozer.,Unknown,28.0980814,-82.1496049,,,OH,6/27/12,"Hav-Tech Inc., Fairfield, OH 45014",Worker installing plywood sheeting on a roof fell from a ladder after suffering an apparent heart attack.,Unknown,39.3454673,-84.5603187,,,ND,6/27/12,"Midwest Steeplejacks, Fargo, ND 58104",Worker died after falling 153 feet from a cellphone tower.,Unknown,46.7866028,-96.830676,,,PA,6/28/12,"R & B Mechanical Inc., West Mittlin, PA 15122",Worker died of a possible heart attack or from being caught between top of aerial lift and the ceiling.,Unknown,40.3509675,-79.9136731,,,KY,6/29/12,"Bluegrass Materials Company LLC, Baxter, KY 40806",Worker at a construction materials company died when the forklift he was operating overturned.,Unknown,36.8598108,-83.330737,,,DC,5/22/12,"AJG Inc., Washington, DC 20008",Worker died after falling through a floor opening at a residential construction site.,Unknown,38.9451658,-77.0622028,,,GA,5/23/12,"Browntree Horses, Macon, GA 31211",Worker died from blunt force trauma to the head when a horse she was caring for kicked or stepped on her.,Unknown,32.8406946,-83.6324022,,,IL,6/7/12,"Bes Packaging Corp., Elk Grove Village, IL 60007",Worker changing a mold on a thermo forming machine was found dead slumped over at the machine.,Unknown,42.0039178,-87.9703461,,,NM,6/24/12,"Baja Ranch LLC, Lordsburg, NM 88045",Worker was run over and killed by a field tractor.,Unknown,32.3503605,-108.7086649,,,LO,6/24/12,"Grand Isle Shipyard Inc., Abbeville, LO 70510",Worker was struck and killed by a forklift after the forklift's brakes failed.,Unknown,29.8159414,-92.2630393,,,TX,6/24/12,"Samsung Austin Semiconductor LLC, Austin, TX 78754",Worker was found laying face down in the doorway of the stairs.,Unknown,30.3558863,-97.6493858,,,